{
  "id": "test-heartbeat-fix-001",
  "title": "Test: Verify heartbeat mechanism works",
  "type": "development",
  "priority": "high",
  "status": "pending",
  "created_at": "2025-11-16T09:30:00.000Z",
  "context": {
    "description": "Simple test task to verify worker heartbeat mechanism is functioning",
    "deliverables": ["Create a simple test file at /tmp/heartbeat-test-complete.txt"]
  }
}
